{
  "schemaVersion": "1.0.0",
  "manifest": {
    "schemaVersion": "1.0.0",
    "datasetId": "synthetic-golden",
    "datasetVersion": "0.1.0-fixture",
    "title": {
      "en": "Synthetic Golden Fixture"
    },
    "description": {
      "en": "Fully synthetic Railway3D fixture for schema and validator development."
    },
    "regionCodes": ["fixture"],
    "bounds": [0, -0.01, 0.03, 0.01],
    "horizontalCrs": "EPSG:4326",
    "canonicalVerticalDatum": "LOCAL_ENGINEERING_DATUM",
    "generatedAt": "2026-06-22T00:00:00Z",
    "sourceSnapshotAt": "2026-06-22T00:00:00Z",
    "generator": {
      "name": "railway3d-pipeline",
      "version": "0.0.0",
      "gitCommit": "bootstrap-fixture",
      "configChecksum": "sha256:1111111111111111111111111111111111111111111111111111111111111111"
    },
    "sourceIds": ["synthetic-authoring-2026-06", "synthetic-review-2026-06"],
    "assets": [],
    "entityCounts": {
      "operators": 1,
      "lines": 1,
      "routes": 2,
      "alignments": 1,
      "segments": 6,
      "stations": 3,
      "profileSamples": 10
    },
    "attributionHtml": "Synthetic fixture authored for Railway3D tests; no external source data.",
    "notices": [
      "Synthetic fixture only. It is not real railway data and must not be used for navigation, surveying, operations, or construction."
    ],
    "compatibility": {
      "minAppVersion": "0.1.0",
      "maxSchemaMajor": 1
    }
  },
  "sources": [
    {
      "id": "synthetic-authoring-2026-06",
      "title": "Railway3D synthetic fixture authoring notes",
      "publisher": "Railway3D project",
      "description": "Hand-authored artificial topology, elevations, and DEM-like ground samples.",
      "license": {
        "id": "CC0-1.0",
        "name": "Creative Commons Zero 1.0",
        "SPDX": "CC0-1.0",
        "attributionRequired": false,
        "shareAlike": false,
        "commercialUseAllowed": true,
        "redistributionAllowed": true,
        "notice": "Synthetic fixture; no external source data."
      },
      "retrievedAt": "2026-06-22T00:00:00Z",
      "sourceValidAt": "2026-06-22",
      "checksum": "sha256:2222222222222222222222222222222222222222222222222222222222222222",
      "citationText": "Railway3D synthetic fixture authoring notes, 2026-06-22.",
      "processingNotes": ["Created solely for tests; not derived from real geography."]
    },
    {
      "id": "synthetic-review-2026-06",
      "title": "Railway3D synthetic conflict review notes",
      "publisher": "Railway3D project",
      "description": "Deliberately conflicting synthetic structure note used to exercise conflict flags.",
      "license": {
        "id": "CC0-1.0",
        "name": "Creative Commons Zero 1.0",
        "SPDX": "CC0-1.0",
        "attributionRequired": false,
        "shareAlike": false,
        "commercialUseAllowed": true,
        "redistributionAllowed": true,
        "notice": "Synthetic fixture; no external source data."
      },
      "retrievedAt": "2026-06-22T00:00:00Z",
      "sourceValidAt": "2026-06-22",
      "checksum": "sha256:3333333333333333333333333333333333333333333333333333333333333333",
      "citationText": "Railway3D synthetic conflict review notes, 2026-06-22.",
      "processingNotes": ["Intentionally conflicts with the authored bridge structure."]
    }
  ],
  "operators": [
    {
      "id": "r3d:zz:synthetic:operator:fixture-rail",
      "name": {
        "en": "Fixture Rail"
      },
      "shortName": {
        "en": "FR"
      },
      "countryCode": "ZZ",
      "sourceRefs": [
        {
          "sourceId": "synthetic-authoring-2026-06",
          "method": "digitized",
          "sourceFeatureId": "operator.fixture-rail"
        }
      ]
    }
  ],
  "lines": [
    {
      "id": "r3d:zz:synthetic:line:golden",
      "operatorIds": ["r3d:zz:synthetic:operator:fixture-rail"],
      "name": {
        "en": "Golden Fixture Line"
      },
      "publicCode": "G",
      "color": "#2F6F73",
      "textColor": "#FFFFFF",
      "routeIds": ["r3d:zz:synthetic:route:main", "r3d:zz:synthetic:route:branch-b"],
      "serviceStatus": "operational",
      "sourceRefs": [
        {
          "sourceId": "synthetic-authoring-2026-06",
          "method": "digitized",
          "sourceFeatureId": "line.golden"
        }
      ]
    }
  ],
  "routes": [
    {
      "id": "r3d:zz:synthetic:route:main",
      "lineId": "r3d:zz:synthetic:line:golden",
      "name": {
        "en": "Station A to Station C"
      },
      "direction": "outbound",
      "segmentRefs": [
        {
          "segmentId": "r3d:zz:synthetic:segment:s01-underground",
          "forward": true,
          "fromChainageM": 0,
          "toChainageM": 700
        },
        {
          "segmentId": "r3d:zz:synthetic:segment:s02-surface",
          "forward": true,
          "fromChainageM": 700,
          "toChainageM": 1200
        },
        {
          "segmentId": "r3d:zz:synthetic:segment:s03-viaduct",
          "forward": true,
          "fromChainageM": 1200,
          "toChainageM": 2000
        },
        {
          "segmentId": "r3d:zz:synthetic:segment:s04-bridge",
          "forward": true,
          "fromChainageM": 2000,
          "toChainageM": 2400
        },
        {
          "segmentId": "r3d:zz:synthetic:segment:s05-unknown",
          "forward": true,
          "fromChainageM": 2400,
          "toChainageM": 3000
        }
      ],
      "stationSequence": [
        {
          "stationId": "r3d:zz:synthetic:station:A",
          "chainageM": 0,
          "stopOrder": 0,
          "platformLevelId": "r3d:zz:synthetic:station-level:A-track"
        },
        {
          "stationId": "r3d:zz:synthetic:station:C",
          "chainageM": 3000,
          "stopOrder": 1,
          "platformLevelId": "r3d:zz:synthetic:station-level:C-track"
        }
      ],
      "lengthM": 3000
    },
    {
      "id": "r3d:zz:synthetic:route:branch-b",
      "lineId": "r3d:zz:synthetic:line:golden",
      "name": {
        "en": "Portal to Station B"
      },
      "direction": "both",
      "segmentRefs": [
        {
          "segmentId": "r3d:zz:synthetic:segment:s06-branch-b",
          "forward": true,
          "fromChainageM": 0,
          "toChainageM": 900
        }
      ],
      "stationSequence": [
        {
          "stationId": "r3d:zz:synthetic:station:B",
          "chainageM": 900,
          "stopOrder": 0,
          "platformLevelId": "r3d:zz:synthetic:station-level:B-track"
        }
      ],
      "lengthM": 900
    }
  ],
  "alignments": [
    {
      "id": "r3d:zz:synthetic:alignment:golden-centerline",
      "name": {
        "en": "Golden fixture representative centerline"
      },
      "role": "representative_centerline",
      "gaugeMm": 1435,
      "segmentIds": [
        "r3d:zz:synthetic:segment:s01-underground",
        "r3d:zz:synthetic:segment:s02-surface",
        "r3d:zz:synthetic:segment:s03-viaduct",
        "r3d:zz:synthetic:segment:s04-bridge",
        "r3d:zz:synthetic:segment:s05-unknown",
        "r3d:zz:synthetic:segment:s06-branch-b"
      ],
      "sourceRefs": [
        {
          "sourceId": "synthetic-authoring-2026-06",
          "method": "digitized",
          "sourceFeatureId": "alignment.golden-centerline"
        }
      ]
    }
  ],
  "segments": [
    {
      "id": "r3d:zz:synthetic:segment:s01-underground",
      "alignmentId": "r3d:zz:synthetic:alignment:golden-centerline",
      "from": {
        "nodeId": "r3d:zz:synthetic:node:A",
        "position": [0, 0]
      },
      "to": {
        "nodeId": "r3d:zz:synthetic:node:portal",
        "position": [0.006, 0]
      },
      "geometry": {
        "type": "LineString",
        "coordinates": [
          [0, 0],
          [0.003, 0],
          [0.006, 0]
        ]
      },
      "lengthM": 700,
      "structure": "underground_tunnel",
      "serviceStatus": "operational",
      "trackCount": 2,
      "gaugeMm": 1435,
      "profileId": "r3d:zz:synthetic:profile:main",
      "sourceRefs": [
        {
          "sourceId": "synthetic-authoring-2026-06",
          "method": "digitized",
          "sourceFeatureId": "segment.s01"
        }
      ],
      "qualityFlags": []
    },
    {
      "id": "r3d:zz:synthetic:segment:s02-surface",
      "alignmentId": "r3d:zz:synthetic:alignment:golden-centerline",
      "from": {
        "nodeId": "r3d:zz:synthetic:node:portal",
        "position": [0.006, 0]
      },
      "to": {
        "nodeId": "r3d:zz:synthetic:node:surface-end",
        "position": [0.01, 0]
      },
      "geometry": {
        "type": "LineString",
        "coordinates": [
          [0.006, 0],
          [0.008, 0],
          [0.01, 0]
        ]
      },
      "lengthM": 500,
      "structure": "surface",
      "serviceStatus": "operational",
      "trackCount": 2,
      "gaugeMm": 1435,
      "profileId": "r3d:zz:synthetic:profile:main",
      "sourceRefs": [
        {
          "sourceId": "synthetic-authoring-2026-06",
          "method": "digitized",
          "sourceFeatureId": "segment.s02"
        }
      ],
      "qualityFlags": []
    },
    {
      "id": "r3d:zz:synthetic:segment:s03-viaduct",
      "alignmentId": "r3d:zz:synthetic:alignment:golden-centerline",
      "from": {
        "nodeId": "r3d:zz:synthetic:node:surface-end",
        "position": [0.01, 0]
      },
      "to": {
        "nodeId": "r3d:zz:synthetic:node:viaduct-end",
        "position": [0.016, 0]
      },
      "geometry": {
        "type": "LineString",
        "coordinates": [
          [0.01, 0],
          [0.013, 0],
          [0.016, 0]
        ]
      },
      "lengthM": 800,
      "structure": "viaduct",
      "serviceStatus": "operational",
      "trackCount": 2,
      "gaugeMm": 1435,
      "profileId": "r3d:zz:synthetic:profile:main",
      "sourceRefs": [
        {
          "sourceId": "synthetic-authoring-2026-06",
          "method": "constraint_solved",
          "sourceFeatureId": "segment.s03"
        }
      ],